gtx1660_vit_B32_224.log
{"input": ["cuda -keys=cuda,gpu -max_num_threads=1024 -thread_warp_size=32", "dense_small_batch.cuda", [["TENSOR", [4, 768], "float32"], ["TENSOR", [1000, 768], "float32"], null, "float32"], {}], "config": {"index": 8, "code_hash": null, "entity": [["tile_k", "sp", [-1, 24]]]}, "result": [[7.481432902033273e-05, 7.560550138632163e-05, 7.561023290203327e-05, 7.596128373382626e-05, 7.602880591497227e-05, 7.665615110905731e-05], 0, 2.813913106918335, 1617773325.9414823], "version": 0.2, "tvm_version": "0.8.dev0"}
{"input": ["cuda -keys=cuda,gpu -max_num_threads=1024 -thread_warp_size=32", "dense_small_batch.cuda", [["TENSOR", [4, 768], "float32"], ["TENSOR", [768, 768], "float32"], null, "float32"], {}], "config": {"index": 9, "code_hash": null, "entity": [["tile_k", "sp", [-1, 32]]]}, "result": [[5.790310579819277e-05, 5.823149134036144e-05, 5.826544465361446e-05, 5.854593975903615e-05, 5.8653141942771084e-05, 5.898111972891567e-05], 0, 2.6711556911468506, 1617773347.4159281], "version": 0.2, "tvm_version": "0.8.dev0"}
{"input": ["cuda -keys=cuda,gpu -max_num_threads=1024 -thread_warp_size=32", "batch_matmul.cuda", [["TENSOR", [4, 50, 3072], "float32"], ["TENSOR", [1, 768, 3072], "float32"], [4, 50, 768]], {}], "config": {"index": 233402, "code_hash": null, "entity": [["tile_y", "sp", [-1, 5, 10]], ["tile_x", "sp", [-1, 12, 1]], ["tile_k", "sp", [-1, 24]], ["auto_unroll_max_step", "ot", 8], ["unroll_explicit", "ot", 1]]}, "result": [[0.0009527312074074076, 0.0009537630370370371, 0.0009607141555555556, 0.0009618669259259259, 0.0009621347999999999, 0.0009710271703703705], 0, 4.522480726242065, 1617773663.2519321], "version": 0.2, "tvm_version": "0.8.dev0"}
{"input": ["cuda -keys=cuda,gpu -max_num_threads=1024 -thread_warp_size=32", "batch_matmul.cuda", [["TENSOR", [4, 50, 768], "float32"], ["TENSOR", [1, 3072, 768], "float32"], [4, 50, 3072]], {}], "config": {"index": 146968, "code_hash": null, "entity": [["tile_y", "sp", [-1, 2, 25]], ["tile_x", "sp", [-1, 16, 3]], ["tile_k", "sp", [-1, 8]], ["auto_unroll_max_step", "ot", 32], ["unroll_explicit", "ot", 0]]}, "result": [[0.0006859871649999999, 0.0006894080349999999, 0.0006897380800000001, 0.0006939183800000001, 0.00069709808, 0.000823692629032258], 0, 4.451254606246948, 1617773983.7436779], "version": 0.2, "tvm_version": "0.8.dev0"}
{"input": ["cuda -keys=cuda,gpu -max_num_threads=1024 -thread_warp_size=32", "batch_matmul.cuda", [["TENSOR", [4, 50, 768], "float32"], ["TENSOR", [1, 768, 768], "float32"], [4, 50, 768]], {}], "config": {"index": 68273, "code_hash": null, "entity": [["tile_y", "sp", [-1, 1, 50]], ["tile_x", "sp", [-1, 96, 1]], ["tile_k", "sp", [-1, 48]], ["auto_unroll_max_step", "ot", 16], ["unroll_explicit", "ot", 0]]}, "result": [[0.00016798469732441472, 0.0001681194866220736, 0.00016811997157190634, 0.0001681483327759197, 0.0001683095585284281, 0.00016847721404682274], 0, 2.457921028137207, 1617774154.593985], "version": 0.2, "tvm_version": "0.8.dev0"}
{"input": ["cuda -keys=cuda,gpu -max_num_threads=1024 -thread_warp_size=32", "batch_matmul.cuda", [["TENSOR", [48, 50, 50], "float32"], ["TENSOR", [48, 64, 50], "float32"], [48, 50, 64]], {}], "config": {"index": 7772, "code_hash": null, "entity": [["tile_y", "sp", [-1, 5, 10]], ["tile_x", "sp", [-1, 16, 2]], ["tile_k", "sp", [-1, 10]], ["auto_unroll_max_step", "ot", 32], ["unroll_explicit", "ot", 0]]}, "result": [[1.2850771344362044e-05, 1.2946695094124358e-05, 1.2973434968625213e-05, 1.2995444000760603e-05, 1.3007226849210878e-05, 1.3034642802814223e-05], 0, 2.4008212089538574, 1617774438.473349], "version": 0.2, "tvm_version": "0.8.dev0"}
{"input": ["cuda -keys=cuda,gpu -max_num_threads=1024 -thread_warp_size=32", "batch_matmul.cuda", [["TENSOR", [48, 50, 64], "float32"], ["TENSOR", [48, 50, 64], "float32"], [48, 50, 50]], {}], "config": {"index": 10272, "code_hash": null, "entity": [["tile_y", "sp", [-1, 10, 5]], ["tile_x", "sp", [-1, 10, 5]], ["tile_k", "sp", [-1, 8]], ["auto_unroll_max_step", "ot", 8], ["unroll_explicit", "ot", 1]]}, "result": [[1.742576959648909e-05, 1.7434588565159086e-05, 1.7508564671461664e-05, 1.7511165183469464e-05, 1.754783615750335e-05, 1.7587673046446422e-05], 0, 2.3816235065460205, 1617774622.7928064], "version": 0.2, "tvm_version": "0.8.dev0"}
{"input": ["cuda -keys=cuda,gpu -max_num_threads=1024 -thread_warp_size=32", "batch_matmul.cuda", [["TENSOR", [4, 50, 768], "float32"], ["TENSOR", [1, 2304, 768], "float32"], [4, 50, 2304]], {}], "config": {"index": 112838, "code_hash": null, "entity": [["tile_y", "sp", [-1, 5, 10]], ["tile_x", "sp", [-1, 16, 3]], ["tile_k", "sp", [-1, 8]], ["auto_unroll_max_step", "ot", 16], ["unroll_explicit", "ot", 0]]}, "result": [[0.0005048357925925927, 0.0005052348370370371, 0.0005090069222222223, 0.0005108678148148148, 0.0005137492407407408, 0.0005164985925925926], 0, 3.884997844696045, 1617774864.1604269], "version": 0.2, "tvm_version": "0.8.dev0"}
{"input": ["cuda -keys=cuda,gpu -max_num_threads=1024 -thread_warp_size=32", "conv2d_nchw.cuda", [["TENSOR", [4, 3, 224, 224], "float32"], ["TENSOR", [768, 3, 32, 32], "float32"], [32, 32], [0, 0, 0, 0], [1, 1], "float32"], {}], "config": {"index": 4120047, "code_hash": null, "entity": [["tile_f", "sp", [-1, 12, 4, 4]], ["tile_y", "sp", [-1, 1, 7, 1]], ["tile_x", "sp", [-1, 1, 1, 1]], ["tile_rc", "sp", [-1, 1]], ["tile_ry", "sp", [-1, 8]], ["tile_rx", "sp", [-1, 4]], ["auto_unroll_max_step", "ot", 1500], ["unroll_explicit", "ot", 1]]}, "result": [[0.00562048919047619, 0.00563435580952381, 0.0056481036190476185, 0.005652772428571428, 0.005690407523809524, 0.005755660238095238], 0, 5.60114312171936, 1617775177.2318377], "version": 0.2, "tvm_version": "0.8.dev0"}
{"input": ["cuda -keys=cuda,gpu -max_num_threads=1024 -thread_warp_size=32", "dense_small_batch.cuda", [["TENSOR", [1, 768], "float32"], ["TENSOR", [1000, 768], "float32"], null, "float32"], {}], "config": {"index": 11, "code_hash": null, "entity": [["tile_k", "sp", [-1, 64]]]}, "result": [[2.0451698798433914e-05, 2.0532741055758068e-05, 2.0602764277035238e-05, 2.0673300391521533e-05, 2.0773647495612258e-05, 2.081302119616579e-05], 0, 2.549665689468384, 1617777291.821459], "version": 0.2, "tvm_version": "0.8.dev0"}
{"input": ["cuda -keys=cuda,gpu -max_num_threads=1024 -thread_warp_size=32", "dense_small_batch.cuda", [["TENSOR", [1, 768], "float32"], ["TENSOR", [768, 768], "float32"], null, "float32"], {}], "config": {"index": 9, "code_hash": null, "entity": [["tile_k", "sp", [-1, 32]]]}, "result": [[1.611637639920494e-05, 1.6138472015901246e-05, 1.6147449419395334e-05, 1.634573386337483e-05, 1.657765341562925e-05, 1.689786138717439e-05], 0, 2.6209356784820557, 1617777332.7606843], "version": 0.2, "tvm_version": "0.8.dev0"}
{"input": ["cuda -keys=cuda,gpu -max_num_threads=1024 -thread_warp_size=32", "batch_matmul.cuda", [["TENSOR", [1, 50, 3072], "float32"], ["TENSOR", [1, 768, 3072], "float32"], [1, 50, 768]], {}], "config": {"index": 121943, "code_hash": null, "entity": [["tile_y", "sp", [-1, 5, 5]], ["tile_x", "sp", [-1, 12, 2]], ["tile_k", "sp", [-1, 12]], ["auto_unroll_max_step", "ot", 32], ["unroll_explicit", "ot", 0]]}, "result": [[0.0002392903327495622, 0.0002395395516637478, 0.00023985047285464097, 0.00023999304028021016, 0.0002430206129597198, 0.00024441498774080563], 0, 4.0819666385650635, 1617777689.4261658], "version": 0.2, "tvm_version": "0.8.dev0"}
{"input": ["cuda -keys=cuda,gpu -max_num_threads=1024 -thread_warp_size=32", "batch_matmul.cuda", [["TENSOR", [1, 50, 768], "float32"], ["TENSOR", [1, 3072, 768], "float32"], [1, 50, 3072]], {}], "config": {"index": 477773, "code_hash": null, "entity": [["tile_y", "sp", [-1, 1, 50]], ["tile_x", "sp", [-1, 48, 1]], ["tile_k", "sp", [-1, 24]], ["auto_unroll_max_step", "ot", 64], ["unroll_explicit", "ot", 1]]}, "result": [[0.00014867641379310344, 0.0001489934275862069, 0.0001494522091954023, 0.00015179722183908045, 0.0001605126206896552, 0.0001635350712643678], 0, 4.529139995574951, 1617778595.3168778], "version": 0.2, "tvm_version": "0.8.dev0"}
{"input": ["cuda -keys=cuda,gpu -max_num_threads=1024 -thread_warp_size=32", "batch_matmul.cuda", [["TENSOR", [1, 50, 768], "float32"], ["TENSOR", [1, 768, 768], "float32"], [1, 50, 768]], {}], "config": {"index": 326101, "code_hash": null, "entity": [["tile_y", "sp", [-1, 1, 10]], ["tile_x", "sp", [-1, 24, 2]], ["tile_k", "sp", [-1, 24]], ["auto_unroll_max_step", "ot", 64], ["unroll_explicit", "ot", 1]]}, "result": [[6.199530891330892e-05, 6.201339396226416e-05, 6.231440679245283e-05, 6.247081245283018e-05, 6.255421611721612e-05, 6.267821001221001e-05], 0, 2.944237232208252, 1617779084.3752794], "version": 0.2, "tvm_version": "0.8.dev0"}
{"input": ["cuda -keys=cuda,gpu -max_num_threads=1024 -thread_warp_size=32", "batch_matmul.cuda", [["TENSOR", [12, 50, 50], "float32"], ["TENSOR", [12, 64, 50], "float32"], [12, 50, 64]], {}], "config": {"index": 23793, "code_hash": null, "entity": [["tile_y", "sp", [-1, 1, 25]], ["tile_x", "sp", [-1, 32, 1]], ["tile_k", "sp", [-1, 50]], ["auto_unroll_max_step", "ot", 64], ["unroll_explicit", "ot", 1]]}, "result": [[4.671010588339535e-06, 4.677409976962608e-06, 4.696012626262626e-06, 4.700365098351941e-06, 4.709218412192096e-06, 4.713467437533227e-06], 0, 2.178544759750366, 1617779492.749819], "version": 0.2, "tvm_version": "0.8.dev0"}
{"input": ["cuda -keys=cuda,gpu -max_num_threads=1024 -thread_warp_size=32", "batch_matmul.cuda", [["TENSOR", [12, 50, 64], "float32"], ["TENSOR", [12, 50, 64], "float32"], [12, 50, 50]], {}], "config": {"index": 8187, "code_hash": null, "entity": [["tile_y", "sp", [-1, 1, 25]], ["tile_x", "sp", [-1, 25, 1]], ["tile_k", "sp", [-1, 16]], ["auto_unroll_max_step", "ot", 64], ["unroll_explicit", "ot", 0]]}, "result": [[6.398271925144662e-06, 6.415135059711906e-06, 6.415539582221858e-06, 6.474811958796733e-06, 6.487081873024994e-06, 6.49167570895063e-06], 0, 2.5000243186950684, 1617779825.0135174], "version": 0.2, "tvm_version": "0.8.dev0"}
{"input": ["cuda -keys=cuda,gpu -max_num_threads=1024 -thread_warp_size=32", "batch_matmul.cuda", [["TENSOR", [1, 50, 768], "float32"], ["TENSOR", [1, 2304, 768], "float32"], [1, 50, 2304]], {}], "config": {"index": 301535, "code_hash": null, "entity": [["tile_y", "sp", [-1, 1, 50]], ["tile_x", "sp", [-1, 32, 1]], ["tile_k", "sp", [-1, 24]], ["auto_unroll_max_step", "ot", 64], ["unroll_explicit", "ot", 0]]}, "result": [[0.00011624221577515865, 0.00011625205167724388, 0.00011698683862194017, 0.0001177999265639166, 0.00011868988848594741, 0.00011882458930190392], 0, 3.762678623199463, 1617780561.5061584], "version": 0.2, "tvm_version": "0.8.dev0"}
{"input": ["cuda -keys=cuda,gpu -max_num_threads=1024 -thread_warp_size=32", "conv2d_nchw.cuda", [["TENSOR", [1, 3, 224, 224], "float32"], ["TENSOR", [768, 3, 32, 32], "float32"], [32, 32], [0, 0, 0, 0], [1, 1], "float32"], {}], "config": {"index": 1817255, "code_hash": null, "entity": [["tile_f", "sp", [-1, 4, 16, 3]], ["tile_y", "sp", [-1, 7, 1, 1]], ["tile_x", "sp", [-1, 1, 1, 1]], ["tile_rc", "sp", [-1, 1]], ["tile_ry", "sp", [-1, 4]], ["tile_rx", "sp", [-1, 4]], ["auto_unroll_max_step", "ot", 1500], ["unroll_explicit", "ot", 0]]}, "result": [[0.001498083, 0.0014998205747126434, 0.0015045741264367817, 0.001516626459770115, 0.0015197499540229884, 0.0019476284444444446], 0, 4.598171710968018, 1617781740.897855], "version": 0.2, "tvm_version": "0.8.dev0"}
{"input": ["cuda -keys=cuda,gpu -max_num_threads=1024 -thread_warp_size=32", "dense_int8.cuda", [["TENSOR", [1, 768], "int8"], ["TENSOR", [1000, 768], "int8"], null, "int32"], {}], "config": {"index": 2829, "code_hash": null, "entity": [["tile_y", "sp", [-1, 1, 1, 1]], ["tile_x", "sp", [-1, 2, 4, 1]], ["tile_k", "sp", [-1, 16]], ["auto_unroll_max_step", "ot", 0]]}, "result": [[6.0055684068227905e-06, 6.010014790664387e-06, 6.023488728082382e-06, 6.040574847918573e-06, 6.068679018726889e-06, 6.097934674565624e-06], 0, 2.4996232986450195, 1617852850.9938562], "version": 0.2, "tvm_version": "0.8.dev0"}
{"input": ["cuda -keys=cuda,gpu -max_num_threads=1024 -thread_warp_size=32", "dense_int8.cuda", [["TENSOR", [1, 768], "int8"], ["TENSOR", [768, 768], "int8"], null, "int32"], {}], "config": {"index": 18588, "code_hash": null, "entity": [["tile_y", "sp", [-1, 1, 1, 1]], ["tile_x", "sp", [-1, 1, 48, 1]], ["tile_k", "sp", [-1, 24]], ["auto_unroll_max_step", "ot", 1500]]}, "result": [[3.3841831232345375e-06, 3.3842992326826595e-06, 3.386820059867617e-06, 3.4080781019435893e-06, 3.417685869231556e-06, 3.44327899574181e-06], 0, 2.5819740295410156, 1617853358.0889394], "version": 0.2, "tvm_version": "0.8.dev0"}
{"input": ["cuda -keys=cuda,gpu -max_num_threads=1024 -thread_warp_size=32", "batch_matmul_int8.cuda", [["TENSOR", [1, 50, 768], "int8"], ["TENSOR", [1, 768, 768], "int8"], [1, 50, 768], "int32"], {}], "config": {"index": 689112, "code_hash": null, "entity": [["tile_f", "sp", [-1, 1, 1, 1]], ["tile_m", "sp", [-1, 1, 10, 5]], ["tile_n", "sp", [-1, 3, 8, 1]], ["tile_k", "sp", [-1, 12]], ["auto_unroll_max_step", "ot", 512]]}, "result": [[1.1780664937494686e-05, 1.1803997533803893e-05, 1.181698027043116e-05, 1.1836217620545966e-05, 1.1860078322986648e-05, 1.18641165915469e-05], 0, 2.5222554206848145, 1617853533.2331963], "version": 0.2, "tvm_version": "0.8.dev0"}
{"input": ["cuda -keys=cuda,gpu -max_num_threads=1024 -thread_warp_size=32", "batch_matmul_int8.cuda", [["TENSOR", [12, 50, 50], "int8"], ["TENSOR", [12, 64, 50], "int8"], [12, 50, 64], "int32"], {}], "config": {"index": 982960, "code_hash": null, "entity": [["tile_f", "sp", [-1, 1, 1, 1]], ["tile_m", "sp", [-1, 5, 10, 1]], ["tile_n", "sp", [-1, 2, 32, 1]], ["tile_k", "sp", [-1, 13]], ["auto_unroll_max_step", "ot", 1024]]}, "result": [[3.276788714390066e-06, 3.2783209763817873e-06, 3.278403944485025e-06, 3.281069373427482e-06, 3.28652686470254e-06, 3.2939652219787356e-06], 0, 2.578234910964966, 1617854073.906007], "version": 0.2, "tvm_version": "0.8.dev0"}
{"input": ["cuda -keys=cuda,gpu -max_num_threads=1024 -thread_warp_size=32", "batch_matmul_int8.cuda", [["TENSOR", [12, 50, 64], "int8"], ["TENSOR", [12, 50, 64], "int8"], [12, 50, 50], "int32"], {}], "config": {"index": 721280, "code_hash": null, "entity": [["tile_f", "sp", [-1, 1, 1, 1]], ["tile_m", "sp", [-1, 1, 10, 5]], ["tile_n", "sp", [-1, 2, 5, 1]], ["tile_k", "sp", [-1, 4]], ["auto_unroll_max_step", "ot", 1024]]}, "result": [[2.826098675310034e-06, 2.8263468151071023e-06, 2.8305885851183763e-06, 2.8327079481397973e-06, 2.834792277339346e-06, 2.858151155580609e-06], 0, 1.8599498271942139, 1617854519.4475307], "version": 0.2, "tvm_version": "0.8.dev0"}
{"input": ["cuda -keys=cuda,gpu -max_num_threads=1024 -thread_warp_size=32", "batch_matmul_int8.cuda", [["TENSOR", [1, 50, 768], "int8"], ["TENSOR", [1, 2304, 768], "int8"], [1, 50, 2304], "int32"], {}], "config": {"index": 2513431, "code_hash": null, "entity": [["tile_f", "sp", [-1, 1, 1, 1]], ["tile_m", "sp", [-1, 2, 5, 5]], ["tile_n", "sp", [-1, 3, 12, 1]], ["tile_k", "sp", [-1, 24]], ["auto_unroll_max_step", "ot", 1024]]}, "result": [[2.5936763922518156e-05, 2.602350570736769e-05, 2.602683621584227e-05, 2.6047362504323766e-05, 2.605651193358699e-05, 2.61475368384642e-05], 0, 3.0755233764648438, 1617854906.8519294], "version": 0.2, "tvm_version": "0.8.dev0"}
{"input": ["cuda -keys=cuda,gpu -max_num_threads=1024 -thread_warp_size=32", "conv2d_NCHWc_int8.cuda", [["TENSOR", [1, 4, 224, 224], "int8"], ["TENSOR", [768, 4, 32, 32], "int8"], [32, 32], [0, 0, 0, 0], [1, 1], "NCHW", "int32"], {}], "config": {"index": 1561897, "code_hash": null, "entity": [["tile_n", "sp", [-1, 1, 1, 1]], ["tile_f", "sp", [-1, 1, 16, 3]], ["tile_y", "sp", [-1, 1, 1, 1]], ["tile_x", "sp", [-1, 1, 7, 1]], ["fuse_yx", "ot", 0], ["tile_rc", "sp", [-1, 1]], ["tile_ry", "sp", [-1, 2]], ["tile_rx", "sp", [-1, 1]], ["reorder_inner", "re", [2, 0, 1]], ["AA_double_buffer", "ot", 0], ["WW_double_buffer", "ot", 0], ["auto_unroll_max_step", "ot", 0]]}, "result": [[0.00029803970544090057, 0.0002997120450281426, 0.0002999689549718574, 0.0003014687542213884, 0.0003019519962476548, 0.00030265078048780493], 0, 3.380498170852661, 1617855082.5021558], "version": 0.2, "tvm_version": "0.8.dev0"}
{"input": ["cuda -keys=cuda,gpu -max_num_threads=1024 -thread_warp_size=32", "batch_matmul_int8.cuda", [["TENSOR", [1, 50, 3072], "int8"], ["TENSOR", [1, 768, 3072], "int8"], [1, 50, 768], "int32"], {}], "config": {"index": 1322390, "code_hash": null, "entity": [["tile_f", "sp", [-1, 1, 1, 1]], ["tile_m", "sp", [-1, 1, 5, 5]], ["tile_n", "sp", [-1, 4, 6, 1]], ["tile_k", "sp", [-1, 24]], ["auto_unroll_max_step", "ot", 1024]]}, "result": [[4.536781856060606e-05, 4.537227803030303e-05, 4.537496818181819e-05, 4.558481136363636e-05, 4.5649453030303026e-05, 4.5720666666666664e-05], 0, 3.038681745529175, 1617855752.5875492], "version": 0.2, "tvm_version": "0.8.dev0"}
{"input": ["cuda -keys=cuda,gpu -max_num_threads=1024 -thread_warp_size=32", "batch_matmul_int8.cuda", [["TENSOR", [1, 50, 768], "int8"], ["TENSOR", [1, 3072, 768], "int8"], [1, 50, 3072], "int32"], {}], "config": {"index": 1652252, "code_hash": null, "entity": [["tile_f", "sp", [-1, 1, 1, 1]], ["tile_m", "sp", [-1, 10, 5, 1]], ["tile_n", "sp", [-1, 4, 24, 1]], ["tile_k", "sp", [-1, 12]], ["auto_unroll_max_step", "ot", 1024]]}, "result": [[3.081652196985778e-05, 3.084651156866907e-05, 3.095897198047124e-05, 3.0968284016132457e-05, 3.11595094459775e-05, 3.1255195287624706e-05], 0, 3.3013837337493896, 1617856078.3283122], "version": 0.2, "tvm_version": "0.8.dev0"}
